{
  "id": "bill_001",
  "status": "PENDING_PAYMENT",
  "created_at": "2026-06-15T00:00:00+08:00",
  "updated_at": "2026-06-15T00:00:00+08:00",
  "owner_scope": "merchant",
  "bill_id": "bill_001",
  "bill_period": "2026-06",
  "bill_type": "SERVICE_FEE",
  "amount": 299.0,
  "payment_notice": "Please pay before due date.",
  "payment_due_date": "2026-07-01",
  "paid_at": "",
  "invoice_note": "Monthly service fee",
  "platform_note": "Generated by platform"
}
